826,conference of the international speech communication association
827,ieee international on-line testing symposium
828,workshop on internet of things for ambient assisted living
829,international conference on internet of things and big data and security
830,"international conference on internet of things, data and cloud computing"
831,international provenance and annotation workshop
832,"international performance, computing, and communications conference"
833,conference on integer programming and combinatorial optimization
834,"international conference on image processing, computer vision, and pattern recognition"
835,international population data linkage network
836,ieee international parallel & distributed processing symposium
837,ieee international parallel & distributed processing symposium workshops
838,international symposium on parameterized and exact computation
839,international conference on information processing and management of uncertainty in knowledge-based systems
840,international conference on image processing and pattern recognition
841,international conference on information processing in sensor networks
842,international conference on image processing theory tools and applications
843,ieee international conference on information reuse and integration
844,ieee international symposium on robotics and intelligent sensors
845,"international conference on infrared, millimeter, and terahertz waves"
846,ieee/rsj international conference on intelligent robots and systems
847,international symposium algorithms and computation
848,international symposium on autonomous decentralized systems
849,ieee international symposium on assembly and manufacturing
850,international symposium on ambient intelligence
851,international conference on intelligent system applications to power systems
852,ieee international symposium on biomedical imaging
853,international symposium on bioinformatics research and applications
854,international supercomputing conference
855,international conference on information security
856,ieee international smart cities conference
857,international symposium on computer architecture
858,ieee international symposium on circuits and systems
859,international symposium on computers and communications
860,ieee international symposium on consumer electronics
861,international symposium on computer and information sciences
862,international symposium on combinatorial optimization
863,international conference on information systems for crisis response and management
864,international conference on intelligent systems design and applications
865,international conference on information systems development
866,international symposium on electronic arts
867,information systems education conference
868,international symposium on experimental robotics
869,ud - international symposium on end-user development
870,ieee pes innovative smart grid technologies
871,ieee pes innovative smart grid technologies conference europe
872,europe - ieee international conference on innovative smart grid technologies
873,ieee international conference on intelligence and security informatics
874,international symposium on integrated circuits
875,ieee international symposium on industrial electronics
876,international conference on information security
877,international symposium on information theory
878,international symposium on low power electronics and design
879,ieee international symposium on multimedia
880,international symposium on mixed and augmented reality
881,intelligent systems for molecular biology / european conference on computational biology
882,international symposium on measurement and control in robotics
883,international society for music information retrieval conference
884,international symposium on methodologies for intelligent systems
885,international symposium on mathematical morphology
886,international symposium on medical robotics
887,ieee international symposium on multiple-valued logic
888,international symposium on neural networks
889,"international symposium on leveraging applications of formal methods, verification and validation"
890,ieee international symposium on realtime distributed computing
891,ieee international symposium on parallel and distributed processing with applications
892,ieee international symposium on performance analysis of systems and software
893,acm international symposium on physical design
894,international symposium on parallel and distributed computing
895,international symposium on quality electronic design
896,ieee international conference on intelligence and safety for robotics
897,acm international conference on interactive surfaces and spaces
898,information security for south africa
899,ieee international solid-state circuits conference
900,international society of scientometrics and informetrics conference
901,ieee international symposium on signal processing and information technology
902,ieee international symposium on software reliability engineering
903,ieee international symposium on software reliability engineering workshops
904,international symposium on software testing and analysis
905,international i*workshop
906,international symposium on visual computing
907,ieee computer society annual symposium on vlsi
908,information security conference
909,international semantic web conference
910,international symposium on wireless communication systems
911,international symposium on wireless and pervasive computing
912,international conference on internet technologies and applications
913,international test conference
914,conference on innovations in theoretical computer science
915,international conference on information technology based higher education and training
916,conference on innovation and technology in computer science education
917,international conference on information technology : new generations
918,international conference on interactive theorem proving
919,international conference on intelligent tutoring systems
920,ieee international conference on intelligent transportation systems
921,interactive tabletops and surfaces
922,international conference on intelligent user interfaces
923,international conference on information visualization
924,international conference on intelligent virtual agents
925,international conference on information visualization theory and applications
926,international conference image and vision computing new zealand
927,intelligent vehicles symposium
928,international work-conference on artificial and natural neural networks
929,international work-conference on bioinformatics and biomedical engineering
930,international workshop on biometrics and forensics
931,international wireless communications and mobile computing conference
932,international workshop on computational semantics
933,international workshop on computational transportation science
934,international workshop on combinatorial algorithms
935,international workshop on principles of software evolution
936,ieee/acm international symposium on quality of service
937,iberchip workshop
938,international workshop on software ecosystems
939,international workshop on science gateways
940,"international conference on systems, signals and image processing"
941,international workshop on telecommunications
942,acm/ieee joint conference on digital libraries
943,joint international conference on serious games
944,international joint conference on computer science and software engineering
945,international conference on legal knowledge and information systems
946,acm sigkdd conference on knowledge discovery and data mining
947,international conference on knowledge discovery and information retrieval
948,"symposium on knowledge discovery, mining and learning"
949,international conference on knowledge-based and intelligent information & engineering systems
950,msta - international kes conference on agents and multi-agent systems: technologies and applications
951,international conference on knowledge engineering and semantic web
952,international conference on knowledge management in organizations
953,workshop on knowledge discovery and data mining meets linked open data
954,international conference on principles of knowledge representation and reasoning
955,acm conference on learning @ scale
956,ci - latin american conference on computational intelligence
957,latin american web congress
958,linux audio conference
959,latin american conference on learning objects and technologies
960,latin-american symposium on dependable computing
961,"latin-american algorithms, graphs and optimization symposium"
962,international learning analytics and knowledge conference
963,latin american networking conference
964,ieee international symposium on local and metropolitan area networks
965,latin-american network operations and management symposium
966,ieee latin american robotics symposium
967,simposio brasileiro de robotica
968,ieee latin american symposium on circuits and systems
969,latin american symposium on theoretical informatics
970,ieee latin america conference on cloud computing and communications
971,ieee latin-american conference on communications
972,international conference on cryptology and information security in latin america
973,ieee latin american test symposium
974,latin american test workshop
975,linguistic annotation workshop
976,latin american workshop on cliques in graphs
977,latin-american workshop on computational neuroscience
978,workshop on lowest cost denominator networking for universal access
979,ieee conference on local computer networks
980,"acm sigplan/sigbed conference on languages, compilers, and tools for embedded systems"
981,"acm sigplan/sigbed conference on languages, compilers, and tools for real-time systems"
982,ieee symposium on large data analysis and visualization
983,symposium on logical foundations of computer science
984,ieee symposium on logic in computer science
985,workshop on learning with imbalanced domains: theory and applications
986,workshop on linked democracy : artificial intelligence for democratic innovation
987,learning and intelligent optimization conference
988,"international conference on logistics, informatics and services sciences"
989,"international workshop on location-based recommendations, geosocial networks and geoadvertising"
990,international workshop on location and the web
991,location privacy and security workshop
992,"international conference on logic for programming, artificial intelligence and reasoning"
993,international conference on logic programming and non-monotonic reasoning
994,international conference on language resources and evaluation
995,"workshop on logical and semantic frameworks, with applications"
996,international workshop on learning technology for education challenges
997,workshop on middleware for context-aware applications in the iot
998,international workshop on multi-agent based simulation
999,international workshop on management of sdn and nfv systems
1000,international workshop on multimedia analysis and retrieval for multimodal interaction
1001,"international symposium on the modeling, analysis, and simulation of computer and telecommunication systems"
1002,workshop in multiagent system based learning environments
1003,mobility analytics from spatial and social data
1004,german conference on multiagent system technologies
1005,international workshop on model-based metaheuristics
1006,international conference on multiple criteria decision making
1007,international conference on mathematics and computation in music
1008,mexican conference on pattern recognition
1009,international workshop on multiple classifier systems multiple classifier systems
1010,international symposium on embedded multicore/many-core systems-on-chip
1011,international conference on modeling decisions for artificial intelligence
1012,ieee international conference on mobile data management
1013,mediterranean conference on control and automation
1014,international conference on management of emergent digital ecosystems
1015,mediterranean ad hoc networking workshop
1016,workshop on manufacturable and dependable multicore architectures at nanoscale
1017,world congress on medical and health informatics
1018,ieee international symposium on medical measurements and applications
1019,ieee/asme international conference on mechatronic and embedded systems and applications
1020,international workshop on meta-learning and algorithm selection
1021,international symposium on mathematical foundations of computer science
1022,ieee international conference on multisensor fusion and integration for intelligent systems
1023,metaheuristics international conference
1024,mexican international conference on artificial intelligence
1025,international conference on medical image computing and computer assisted intervention
1026,ieee/acm international symposium on microarchitecture
1027,international middleware conference
1028,medical informatics europe
1029,acm siggraph conference on motion in games
1030,"international conference on microwave, radar and wireless communications"
1031,workshop on modeling in software engineering
1032,international conference on machine learning and data mining in pattern recognition
1033,ieee international workshop on machine learning for signal processing
1034,international conference on methods and models in automation and robotics
1035,international conferences on advances in multimedia
1036,international conference on multimedia modelling
1037,international workshop on multilayer music representation and processing
1038,international workshop on multimedia and signal processing
1039,acm multimedia systems conference
1040,workshop on mobility in the evolving internet architecture
1041,acm/ieee international conference on mobile computing and networking
1042,acm international symposium on mobile ad hoc networking and computing
1043,"international conference on mobile cloud, computing and service engineering"
1044,international conference on human-computer interaction with mobile devices and services adjunct
1045,international conference on mobile software engineering and systems
1046,"international conference on mobile wireless middleware, operating systems, and applications"
1047,"international conference on mobile and ubiquitous systems: computing, networking and services"
1048,"annual international conference on mobile systems, applications, and services"
1049,acm international symposium on mobility management and wireless access
1050,international conference on model driven engineering languages and systems
1051,international conference on model-driven engineering and software development
1052,international conference on modularity
1053,international conference on advances in mobile computing & multimedia
1054,international conference on selected topics in mobile and wireless networking
1055,models and paradigms for planning under uncertainty: a broad perspective workshop
1056,international symposium on multi-robot and multi-agent systems
1057,ieee international conference on mobile services
1058,international manufacturing science and engineering conference
1059,"international conference on modelling, simulation and identification"
1060,international conference on mobile ad-hoc and sensor networks
1061,working conference on mining software repositories
1062,ieee symposium on mass storage systems and technologies
1063,"international conference on modeling, simulation and visualization methods"
1064,"acm international conference on modeling, analysis and simulation of wireless and mobile systems"
1065,international workshop on managing technical debt
1066,international conference on metadata and semantics research
1067,ieee workshop on managing ubiquitous communications and services
1068,international workshop on the analysis of multitemporal remote sensing images
1069,international conference on mobile and ubiquitous multimedia
1070,iapr international conference on machine vision applications
1071,workshop on multiword expressions
1072,international midwest symposium on circuits and systems
1073,north american chapter of the association for computational linguistics annual meeting
1074,world congress on nature and biologically inspired computing
1075,annual conference of the north american fuzzy information processing society
1076,ieee international symposium on network computing and applications
1077,network and distributed system security symposium
1078,workshop on neural-symbolic learning and reasoning
1079,ieee conference on network softwarization
1080,ieee netsoft conference and workshops
1081,international conference on networked systems
1082,ifip networking conference
1083,international telecommunications network strategy and planning symposium
1084,neural information processing systems
1085,"international conference on internet of things, smart spaces, and next generation networks and systems"
1086,ieee international new circuits and systems conference
1087,nasa formal methods symposium
1088,international workshop on new frontiers in mining complex patterns
1089,ieee conference on network function virtualization and software defined networks
1090,international conference on new interfaces for musical expression
1091,international conference on application of natural language to information systems
1092,international workshop on natural language processing and cognitive science
1093,international workshop on non-monotonic reasoning
1094,european conference on networks and optical communications
1095,acm/ieee international symposium on networks-on-chip
1096,international conference on network of the future
1097,ieee/ifip network operations and management symposium
1098,nordic circuits and systems conference
1099,nordic conference on human-computer interaction
1100,networked systems design and implementation
1101,network and system security
1102,"ifip international conference on new technologies, mobility and security"
1103,nordic workshop on programming theory
1104,ieee oceans conference
1105,ieee optical fiber communication conference
1106,international workshop on ontology matching
1107,international conference on optical network design and modeling
1108,brazilian seminar on ontologies
1109,"conference on object-oriented programming systems, languages, and applications"
1110,international symposium on open collaboration
1111,international conference on principles of distributed systems
1112,international conference on operations research
1113,usenix symposium on operating systems design and implementation
1114,international conference on open source systems
1115,australian conference on human-computer interaction
1116,international conference on peer-to-peer computing
1117,"international conference on practical applications of agents, multi-agent systems and sustainability"
1118,international conference on practical applications of computational biology & bioinformatics
1119,ieee pacific visualization symposium
1120,pacific asia conference on information systems
1121,international conference on parallel computing technologies
1122,international conference on parallel architectures and compilation techniques
1123,acm sigsim conference on principles of advanced discrete simulation
1124,pacific-asia conference on knowledge discovery and data mining
1125,passive and active network measurement conference
1126,international conference on parallel computing
1127,international conference on the practice and theory of automated timetabling
1128,"international workshop on power and timing modeling, optimization and simulation"
1129,international conferences on pervasive patterns and applications
1130,picture coding symposium
1131,participatory design conference
1132,"international conference on parallel and distributed computing, applications and technologies"
1133,ifac international conference on programmable devices and embedded systems
1134,"euromicro international conference on parallel, distributed and network-based processing"
1135,international conference on parallel and distributed processing techniques and applications
1136,"acm international symposium on performance evaluation of wireless ad hoc, sensor, and ubiquitous networks"
1137,pervasive and embedded computing and communication systems
1138,international conference on pervasive computing and communications
1139,ieee international conference on pervasive computing and communication workshops
1140,international conference on pervasive computing technologies for healthcare
1141,ieee power & energy society general meeting
1142,international workshop on principles of engineering service-oriented and cloud systems
1143,privacy enhancing technologies
1144,acm international conference on pervasive technologies related to assistive environments
1145,proceedings on privacy enhancing technologies
1146,pacific conference on computer graphics and applications
1147,international conference on probabilistic graphical models
1148,"international symposium on personal, indoor and mobile radio communications"
1149,international conference on practice and theory in public key cryptography
1150,workshop on evaluation and usability of programming languages and tools
1151,international symposium on platial information science
1152,sigplan conference on programming language design and implementation
1153,conference on pattern languages of programs
1154,acm symposium on principles of distributed computing
1155,symposium on principles of database systems
1156,ifip wg 8.1 working conference on the practice of enterprise modelling
1157,symposium on principles of programming languages
1158,international conference on principles of security and trust
1159,siam conference on parallel processing for scientific computing
1160,international conference on parallel processing and applied mathematics
1161,international symposium on principles and practice of declarative programming
1162,"workshop on planning, perception and navigation for intelligent vehicles"
1163,acm sigplan symposium on principles and practice of parallel programming
1164,international conference on parallel problem solving from nature
1165,pacific rim international symposium on dependable computing
1166,international workshop on prediction of human mobility
1167,iapr international conference on pattern recognition in bioinformatics
1168,nternational conference on principles and practice of multi-agent systems
1169,international conference on product-focused software process improvement
1170,international conference on predictive models and data analytics in software engineering
1171,international conference on computational processing of the portuguese language
1172,pacific symposium on biocomputing
1173,power systems computation conference
1174,pacific-rim symposium on image and video technology
1175,"international conference on privacy, security and trust"
1176,acm symposium on qos and security for wireless and mobile networks
1177,international conference on quantitative evaluation of systems
1178,quality of models and models of quality workshop
1179,international workshop on quality of multimedia experience
1180,international acm sigsoft conference on the quality of software architectures
1181,"ieee international conference on software quality, reliability and security"
1182,"ieee international conference on software quality, reliability and security companion"
1183,international conference on quality of information and communications technology
1184,conference on research in adaptive and convergent systems
1185,european conference on radiation effects on components and systems
1186,ieee internacional conference on robotics and automation for humanitarian applications
1187,"international symposium on research in attacks, intrusions, and defenses"
1188,annual reliability and maintainability symposium
1189,international conference on recent advances in natural language processing
1190,ieee international conference on real-time computing and robotics
1191,international conference on research challenges in information science
1192,ieee international requirements engineering conference
1193,international conference on research in computational molecular biology
1194,international conference on reconfigurable computing and fpgas
1195,international symposium on reconfigurable communication-centric systems-on-chip
1196,acm conference on recommender systems
1197,international working conference on requirements engineering: foundations for software quality
1198,international workshop on requirements engineering and law
1199,"workshop on reactivity, events and modularity"
1200,ieee international workshop on requirements patterns
1201,international workshop on replication in empirical software engineering research
1202,ieee international conference on rfid
1203,international conference on research in intelligent and computing in engineering
1204,european conference on radiation and its effects on components and systems
1205,ieee international symposium on robot and human interactive communication
1206,ieee international conference on robotics and biomimetics
1207,robocup international symposium
1208,ieee international conference on soft robotics
1209,ieee international symposium on robotic and sensors environments
1210,ieee international symposium on rapid system prototyping
1211,robotics: science and systems
1212,international conference on rewriting techniques and applications
1213,ieee real-time and embedded technology and applications symposium
1214,international conference on embedded and real-time computing systems and applications
1215,international conference on real time intelligent systems
1216,real-time systems symposium
1217,international web rule symposium
1218,international joint conference on rules and reasoning
1219,acm symposium on applied computing
1220,international conference on smart communications in network technologies
