407,international conference on electronic government/international conference for e-democracy and open government
408,international conference on electronic government and the information systems perspective
409,acm sigchi symposium on engineering interactive computing systems
410,international conference on emerging intelligent data and web technologies
411,spie human vision and electronic imaging
412,"iaria international conference on information, process, and knowledge management"
413,"electronics, computers and artificial intelligence"
414,international workshop on the use of gis in emergency management
415,international workshop on engineering multiagent systems
416,annual international conference of the ieee engineering in medicine and biology society
417,ieee-embs international conference on biomedical and health informatics
418,conference on empirical methods in natural language processing
419,international conference on evolutionary multi-criterion optimization
420,acm international conference on embedded software
421,encontro nacional da associacao nacional de pos-graduacao e pesquisa em administracao
422,international conference on evaluation of novel approaches to software engineering
423,"iaria international conference on smart grids, green communications and it energy-aware technologies"
424,encontro nacional de inteligencia artificial e computacional
425,european network intelligence conference
426,portuguese conference on artificial intelligence
427,international conference on conceptual modeling
428,acm sigplan erlang workshop
429,european symposium on algorithms
430,"european symposium on artificial neural networks, computational intelligence and machine learning"
431,cience - ieee international conference on e-science
432,joint meeting on european software engineering conference and foundations of software engineering
433,workshop latinoamericano de ingenieria de software experimental
434,acm/ieee international symposium on empirical software engineering and measurement
435,european conference on service-oriented and cloud computing
436,european symposium on programming
437,european symposium on research in computer security
438,european solid state circuits conference
439,european solid state device research conference
440,extended semantic web conference
441,european semantic web conference
442,"iaria international conference on ehealth, telemedicine, and social medicine"
443,ieee international conference on emerging technologies and factory automation
444,biennial acm symposium on eye tracking research & applications
445,ieee european test symposium
446,ieee/ifip international conferences on embedded and ubiquitous computing
447,european conference on networks and communications
448,european conference on multi-agent systems
449,european conference on operational research
450,european workshop on computational geometry
451,"european conference on combinatorics, graph theory and applications"
452,international conference on theory and applications of cryptographic techniques
453,european conference on genetic programming
454,european association for computer graphics
455,eurohaptics
456,european conference on interactive tv and video
457,euromicro conference on software engineering and advanced applications
458,european mpi users group meeting
459,european conference on parallel computing
460,parallel processing workshops
461,european public key infrastructure workshop
462,european conference on pattern languages of programs
463,congress on modelling and simulation
464,european conference on software process improvement
465,european conference on computer systems
466,eg/vgtc conference on visualization
467,eurovis workshop on visual analytics (eurova)
468,conference of the european society for fuzzy logic and technology
469,european signal processing conference
470,european workshop on visual information processing
471,electronic visualisation and the arts
472,european conference on the applications of evolutionary computation
473,european conference on evolutionary computation in combinatorial optimization
474,embedded world conference
475,european workshop on software defined networks
476,european conference on wireless sensor networks
477,workshop on exascale mpi
478,experiment@ international conference
479,international conference on formal aspects of component software
480,international conference on fundamental approaches to software engineering
481,usenix conference on file and storage technologies
482,international conference on financial cryptography and data security
483,ieee annual international symposium on field-programmable custom computing machines
484,international symposium on fundamentals of computation theory
485,international conference on fuzzy computation theory and applications
486,foundations of digital games
487,forum on specification and design languages
488,international conference on frontiers in education: computer science and computer engineering
489,federated conference on computer science and information systems
490,conference on formal grammar
491,ieee international conference on automatic face and gesture recognition
492,international conference on future internet of things and cloud
493,ieee frontiers in education conference
494,international conference on frontiers of information technology
495,international florida artificial intelligence conference
496,international symposium on formal methods
497,international conference on formal methods in computer-aided design
498,ieee symposium on foundations of computational intelligence
499,ieee annual symposium on foundations of computer science
500,acm conference on foundations of genetic algorithms
501,international symposium on foundations on information and knowledge systems
502,international conference on formal ontology in information systems
503,international conference on formal modeling and analysis of timed systems
504,international workshop on feature-oriented software development
505,international conference on foundations of software science and computation structures
506,symposium on field programmable gate arrays
507,international conference on field-programmable logic and applications
508,international symposium on frontiers of combining systems
509,international conference on formal structures for computation and deduction
510,fast software encryption
511,international conference on fuzzy systems and knowledge discovery
512,annual conference on foundations of software technology and theoretical computer science
513,future technologies conference
514,workshop on fault tolerance for hpc at extreme scale
515,international conference on information fusion
516,ieee international conference on fuzzy systems
517,annual simulation and ai in games conference
518,international workshop on games and software engineering
519,ieee global conference on consumer electronics
520,genetic and evolutionary computation conference
521,"international conference on economics of grids, clouds, systems and services"
522,"ieee games, entertainment, media conference"
523,international workshop on ai for geographic knowledge discovery
524,brazilian symposium on geoinformatics
525,workshop on privacy in geographic information collection and analysis
526,"iaria international conference on advanced geographic information systems, applications, and services"
527,international workshop on geospatial simulation
528,graphics interface conference
529,global information infrastructure and networking symposium
530,global internet of things summit
531,workshop on geographic information retrieval
532,acm sigspatial international conference on advances in geographic information systems
533,international conference on geographic information science
534,workshop of the ais special interest group for ict in global development
535,global conference on signal and information processing
536,ieee global communications conference
537,great lakes symposium on vlsi
538,acm great lakes symposium on vlsi
539,international conference on grid and pervasive computing
540,acm international conference on generative programming: concepts and experiences
541,international workshop on querying graph structured data (edbt)
542,international conference on computer graphics theory and applications
543,ieee international conference on green computing and communications
544,international workshop on green and sustainable software
545,international conference on supporting group work
546,workshop on new directions in geovisual analytics
547,international conference on hybrid artificial intelligence systems
548,ieee haptics symposium
549,ieee international symposium on high assurance systems engineering
550,international conference on human-computer interaction
551,workshop on human computer interaction in third places
552,international conference on health and social care information systems and technologies
553,conference on human computation and crowdsourcing
554,international working conference on human-centred software engineering
555,"ieee international conference on e-health networking, application & services"
556,international conference on health informatics
557,hawaii international conference on system sciences
558,ieee international conference on high performance computing
559,international conference on hybrid intelligent systems
560,international workshop on hybrid metaheuristics
561,ieee international symposium on hardware oriented security and trust
562,acm workshop on hot topics in networks
563,ieee international symposium on high performance computer architecture
564,international conference on high performance computing and communications
565,international conference on high performance computing & simulation
566,international symposium on high performance distributed computing
567,high-performance graphics
568,workshop on high performance and programmable networking
569,ieee high performance switching and routing
570,workshop on hybrid reasoning
571,acm/ieee international conference on human robot interaction
572,acm conference on hypertext and social media
573,ieee ras international conference on humanoid robot
574,international haifa verification conference
575,acm conference on hypertext and hypermedia
576,ieee international instrumentation and measurement technology conference
577,international conference of the italian association for artificial intelligence
578,industry applications society annual meeting
579,ieee/wic/acm international conference on intelligent agent technology
580,ifac symposium on intelligent autonomous vehicles
581,ibero-american conference on artificial intelligence
582,workshop iberchip
583,iberian conference on pattern recognition and image analysis
584,ieee international conference on cloud engineering
585,"international joint conference on knowledge discovery, knowledge engineering and knowledge management"
586,international conference on algorithms and architectures for parallel processing
587,international conference on agents and artificial intelligence
588,international conference on autonomic computing
589,international conference on adaptive and intelligent systems
590,international conference on artificial intelligence and soft computing
591,international conference on artificial intelligence
592,"international colloquium on automata, languages, and programming"
593,ieee international conference on advanced learning technologies
594,international conference on artificial neural networks
595,international conference on automated planning and scheduling
596,international conference on advanced robotics
597,"international conference on control, automation, robotics and vision"
598,international conference on advanced robotics and mechatronics
599,international conference on artificial life and robotics
600,ieee international conference on autonomous robot systems and competitions
601,"international conference on control, automation, robotics and vision"
602,iaria international conference on autonomic and autonomous systems
603,"ieee international conference on acoustics, speech and signal processing"
604,international conference on artificial reality and telexistence
605,international conference on biometrics
606,ieee international conference on communications
607,ieee international conference on control and automation
608,international conference on computational advances in bio and medical sciences
609,ieee/acm international conference on computeraided design
610,"international conference on control, automation and robotics"
611,international conference on computational creativity
612,international conference on computers communications and control
613,international conference on computer communications and networks
614,international conference on computer design
615,"international caribbean conference on devices, circuits and systems"
616,ieee international conference on consumer electronics
617,international conference on computers in education
618,ieee international conference on consumer electronics berlin
619,ieee international conference on consumer electronics taiwan
620,international conference on computers helping people with special needs
621,international conference on computational intelligence and computing research
622,international conference on computational logistics
623,"international conference on computing, networking and communications"
624,ieee international conference on intelligent computer communication and processing
625,international conference on cyber-physical systems
626,international command and control research and technology symposium
627,international conference on computational science
628,international conference on computational science and its applications
629,ieee international conference on computer vision
630,international conference on connected vehicles & exp
631,ieee international conference on computer vision workshops
632,ieee international conference on communications workshops
633,international conference on document analysis and recognition
634,international conference on distributed computing and networking
635,international conference on distributed computing systems
636,international conference on distributed computing systems workshops
637,ieee international conference on data engineering
638,ifip international conference on digital forensics
639,international conference on digital information management
640,international conference on digital image processing
641,ieee international conference on data mining
642,ieee international conference on data mining workshop (icdmw)
643,international conference on imaging for crime detection and prevention
644,iaria international conference on digital society
645,ieee international conference on digital signal processing
646,international conference on database theory
647,"international conference on emerging trends in computing, communication and nanotechnology"
648,ieee international conference on e-business engineering
649,ifip international conference on entertainment computing
650,international conference on engineering of complex computer
651,"ieee international conference on electronics, circuits and systems"
652,international conference on engineering design
653,international conference on theory and practice of eletronic governance
654,international conference on enterprise information systems
655,international computing education research
656,"international conference of education, research and innovation"
657,international conference on formal engineering methods
658,international conference on frontiers in handwriting recognition
659,international conference on functional programming
660,"international conference on game jams, hackathons, and game creation events"
661,ieee international conference on global software engineering
662,international conference on graph transformations
663,international conference on graph transformation
664,ieee international conference on healthcare informatics
665,ieee international conference on harmonics and power quality
666,international conference on image analysis and processing
667,international conference on image analysis and recognition
668,international conference on intelligent computing
669,international conference on information and communications security
670,international conference on interactive digital storytelling
671,international conference on industrial engineering and operations management
672,international conference on image and graphics
673,"international conference on innovations in information, embedded and communication systems"
674,"international conference on informatics in control, automation and robotics"
675,international conference on the internet of things
676,ieee international conference on image processing
677,international conference on information quality
678,international conference on information systems
679,international conference on information security and cryptology
680,international conference on informatics and semiotics in organisations
681,international conference on information systems security
682,international conference on information systems security and privacy
683,international conference on information and software technologies
684,ieee international conference on industrial technology
685,international conference on information theoretic security
686,international conference for internet technology and secured transactions
687,international conference on information visualisation
688,"international conference on image, vision and computing"
689,iaria international conference on internet and web applications and services
690,international conference on interactive collaborative learning
691,indian conference on logic and its applications
692,international conference on logic programming
693,international conference on learning representations
694,international conference on microelectronics
695,ieee international conference on mechatronics and automation
696,international computer music conference
697,"international conference on mechatronics, control and robotics"
698,ieee international conference on multimedia computing and systems
699,ieee international conference on multimedia and expo
700,ieee international conference on multimedia and expo workshops
701,acm international conference on multimodal interfaces
702,international conference on machine learning
703,ieee international conference on machine learning and applications
704,international conference on music perception and cognition
705,acm international conference on multimedia retrieval
706,acm international conference on information-centric networking
707,iaria international conference on networks
708,international conference on natural computation
709,"international conference on natural computation, fuzzy systems and knowledge discovery"
710,international conference on network protocols
711,iaria international conference on networking and services
712,"ieee international conference on networking, sensing and control"
713,international conference on information networking
714,international conference on internet computing and internet of things
715,international conference on neural information processing
716,iaria international conference on systems
717,international conference on operations research and enterprise systems
718,ieee international conference on rehabilitation robotics
719,international conference on parallel and distributed systems
720,international conference on program comprehension
721,international conference on performance engineering
722,"international conference on philosophy, music and emotion"
723,international conference on parallel processing
724,international conference on pattern recognition
725,ieee international conference on robotics and automation
726,international conference on robotics and automation engineering
727,international conference on supercomputing
728,working ieee/ifip conference on software architecture
729,international conference on semantic computing
730,international conference on software engineering
731,iaria international conference on software engineering advances
732,international conference on software engineering workshops
733,international conference on swarm intelligence
734,international conference on smart learning environments
735,ieee international conference on software maintenance and evolution
736,iaria international conference on systems and networks communications
737,international conference on software business
738,international conference on service oriented computing
739,international conference on software technologies
740,"international conference on signal processing, communication, power and embedded system"
741,international conference on software reuse
742,international conference on sensing technology
743,"ieee international conference on software testing, verification and validation"
744,international conference on telecommunications
745,international colloquium on theoretical aspects of computing
746,ieee international conference on tools with artificial intelligence
747,italian conference on theoretical computer science
748,conference on the theory of information retrieval
749,international conference on transparent optical networks
750,ifip international conference on testing software and systems
751,international conference on unmanned aircraft systems
752,international conference on ultra modern telecommunications
753,international conference on visualization: imaging and image processing
754,international conference on virtual rehabilitation
755,international conference on virtual reality and visualization
756,international conference on computer vision systems
757,international conference on web engineering
758,international conference on www/internet
759,iaria international conference on wireless and mobile communications
760,international conference on wireless networks
761,ieee international conference on web services
762,international aaai conference on web and social media
763,international symposium on intelligent distributed computing
764,international conference on internet and distributed computing systems
765,international conference on intelligent data engineering and automated learning
766,international database engineering and applications symposium
767,international conference on industrial engineering & other applications of appled intelligence systems
768,annual conference of the ieee industrial electronics society
769,ieee international escience conference
770,ieee international conference on imaging systems and techniques
771,ieee conference on nanotechnology
772,ieee symposium on security and privacy
773,ieee visualization
774,ieee international conference on cloud computing
775,ieee symposium on intelligent agents
776,ieee international conference on cognitive computing
777,ieee international symposium on wearable computers
778,international conference on nanotechnology
779,ieee international conference on services computing
780,international congress on environmental modelling & software
781,ifip international embedded systems symposium
782,world congress of the international federation of automatic control
783,ifip international information security conference
784,international conference on integrated formal methods
785,world congress of international fuzzy systems association
786,international conference on fuzzy theory and its applications
787,ieee international geoscience and remote sensing symposium
788,ieee international games innovation conference
789,international green and sustainable computing conference
790,acm workshop on information hiding and multimedia security
791,simposio brasileiro sobre fatores humanos em sistemas computacionais
792,conference francophone sur linteraction homme-machine
793,international conference on intelligent information hiding and multimedia signal processing
794,italian information retrieval workshop
795,ieee international symposium on workload characterization
796,international conference on information integration and web-based applications & services
797,international joint conference on artificial intelligence
798,international joint conference on automated reasoning
799,ieee international joint conference on biometrics        
800,international joint conference on computational intelligence
801,international joint conference on natural language processing
802,ieee international joint conference on neural networks
803,interaction latin america
804,international conference on inductive logic programming
805,ifip/ieee international symposium on integrated network management
806,acm internet measurement conference
807,"international conference on interactive mobile communication, technologies and learning"
808,international conference on ubiquitous information management and communication
809,international conference on innovative mobile and internet services in ubiquitous computing
810,sbmo/ieee mtt-s international microwave and optoelectronics conference
811,"annual international mixed-signals, sensors and systems test workshop"
812,international conference on intelligent networking and collaborative systems
813,ieee international conference on industrial informatics
814,international conference on cryptology in india
815,international conference on industry applications
816,ieee international conference on computer communications
817,ieee information visualization
818,international natural language generation conference
819,international network optimization conference
820,international conference on innovative computing technology
821,"international technology, education and development conference"
822,iaria international conference on intelligent systems and applications
823,sai intelligent systems conference
824,international conference on human computer interaction
825,ifip tc 13 international conference on human-computer interaction
